Nome,Função,COREN-SP,Turno,Horário,Plantão,Setor,Setores Preferidos,Mês,Dia 2,Dia 4,Dia 6,Dia 8,Dia 10,Dia 12,Dia 14,Dia 16,Dia 18,Dia 20,Dia 22,Dia 24,Dia 26,Dia 28,Dia 30
Sara Kim,Enfermeiro,800019.0,Noturno,19x07,B,Sala de medicação,"Sala de medicação, Repouso/observação",Maio de 2025,N,N,N,N,N,N,N,N,N,N,N,N,N,N,N
Fábio Cunha,Auxiliar de enfermagem,600017.0,Noturno,19x07,B,Sala de medicação,"Repouso/observação, Sala de medicação, Classificação de risco",Maio de 2025,N,N,N,N,N,N,N,N,N,N,N,N,N,N,N
Rafael Mello,Técnico de enfermagem,581678.0,Noturno,19x07,B,Sala de medicação,"Repouso/observação, Sala de medicação, Sala de sutura e CME",Maio de 2025,N,N,N,N,N,N,N,N,N,N,N,N,N,N,N
Yuki Sato,Auxiliar de enfermagem,700013.0,Noturno,19x07,B,Sala de medicação,"Sala de sutura e CME, Sala de medicação",Maio de 2025,N,N,N,N,N,N,N,N,N,N,N,N,N,N,N
Tainá Ribeiro,Técnico de enfermagem,600020.0,Noturno,19x07,B,Sala de medicação,"Classificação de risco, Sala de medicação, Repouso/observação",Maio de 2025,N,N,N,N,N,N,N,N,N,N,N,N,N,N,N
Beatriz Silveira,Auxiliar de enfermagem,600005.0,Noturno,19x07,B,Sala de medicação,"Repouso/observação, Classificação de risco, Sala de medicação",Maio de 2025,N,N,N,N,N,N,N,N,N,N,N,N,N,N,N
Giovana Martins,Enfermeiro,600012.0,Noturno,19x07,B,Sala de medicação,"Sala de medicação, Sala de emergência, Repouso/observação",Maio de 2025,N,N,N,N,N,N,N,N,N,N,N,N,N,N,N
Paulo Sérgio,Auxiliar de enfermagem,600023.0,Noturno,19x07,B,Sala de medicação,"Sala de medicação, Repouso/observação, Sala de sutura e CME",Maio de 2025,N,N,N,N,N,N,N,N,N,N,N,N,N,N,N
